demographic,description
All Individuals,<h4>All individuals</h4><p>Everyone ages 62 and older in DYNASIM</p>
Sex,<h4>Sex</h4><p>Individuals are classified as male or female. Sex does not change over time in DYNASIM.</p>
Race/Ethnicity,"<h4>Race or ethnicity</h4><p>Individuals are classified as one of four racial or ethnic groups: Hispanic (regardless of race), non-Hispanic white, non-Hispanic black, or other. Race and ethnicity do not change over time in DYNASIM.</p>"
Education,"<h4>Education</h4><p>Individuals are classified as high school dropout, high school graduate, some college, and college graduate. Education can increase over time in DYNASIM.</p>"
Marital Status,"<h4>Marital status</h4><p>Individuals are classified as single (never married), married, divorced, or widowed. Marital status can change over time in DYNASIM.</p>"
Income Quintile,<h4>Shared income quintile</h4><p>The fifth of the income distribution where a person&#8217;s shared annuity income belongs. This is calculated by ordering shared annuity incomes from smallest to largest and then dividing those incomes into five equally sized ordered groups. Shared annuity income includes half the couple&#8217;s annuity income in years a person is married and own annuity income in years a person is unmarried.</p>
Lifetime Earnings Quintile,"<h4>Shared lifetime earnings quintile</h4><p>Shared lifetime earnings quintile is the fifth of the income distribution where an individual&#8217;s shared lifetime earnings belong. This is calculated by ordering shared averaged indexed monthly earnings, a measure of lifetime earnings, from smallest to largest, then dividing those incomes into five equally sized ordered groups. Shared lifetime earnings include half the couple&#8217;s earnings in years a person is married and own earnings in years a person is unmarried.</p>"
